title,link,description
Computer Sciences & Mathematics Forum*,https://www.mdpi.com/journal/csmf,"Computer Sciences & Mathematics Forum is an open access journal dedicated to publishing findings resulting from academic conferences, workshops, and similar events in the area of computer science and mathematics. Each conference proceeding can be individually indexed, is citable via a digital object identifier (DOI), and is freely available under an open access license. The conference organizers and proceedings editors are responsible for managing the peer-review process and selecting papers for conference proceedings."
Computers,https://www.mdpi.com/journal/computers,"Computers is an international, scientific, peer-reviewed, open access journal of computer science, including computer and network architecture and computer–human interaction as its main foci, published monthly online by MDPI."
Condensed Matter,https://www.mdpi.com/journal/condensedmatter,"Condensed Matter is an international, peer-reviewed, open access journal on the physics of condensed matter published quarterly online by MDPI."
Conservation,https://www.mdpi.com/journal/conservation,"Conservation is an international, peer-reviewed, open access journal on the biological, sociological, ethical, and economic and other transdisciplinary dimensions of conservation, published quarterly online by MDPI. The World Association of Zoos and Aquariums (WAZA) is affiliated with Conservation and its members receive discounts on the article processing charges."
Construction Materials,https://www.mdpi.com/journal/constrmater,"Construction Materials is an international, peer-reviewed, open access journal on construction materials published quarterly online by MDPI."
Corrosion and Materials Degradation,https://www.mdpi.com/journal/cmd,"Corrosion and Materials Degradation is an international, peer-reviewed, open access journal on corrosion, environment-assisted degradation, corrosion mitigation, corrosion mechanism and corrosion monitoring, published quarterly online by MDPI."
Cosmetics,https://www.mdpi.com/journal/cosmetics,"Cosmetics is an international, scientific, peer-reviewed, open access journal on the science and technology of cosmetics published bimonthly online by MDPI."
COVID,https://www.mdpi.com/journal/covid,"COVID is an international, peer-reviewed, open access journal on the study of coronaviruses, coronavirus-related diseases and global impact, published monthly online by MDPI."
Crops,https://www.mdpi.com/journal/crops,"Crops is an international, peer-reviewed, open access journal on the science and technology of crops published quarterly online by MDPI."
Cryptography,https://www.mdpi.com/journal/cryptography,"Cryptography is an international, scientific, peer-reviewed, open access journal on cryptography published quarterly online by MDPI."
Crystals,https://www.mdpi.com/journal/crystals,"Crystals is an international, peer-reviewed, open access journal on Crystallography published monthly online by MDPI. The Professional Committee of Key Materials and Technology for Electronic Components (PC-KMTEC) is affiliated with Crystals and its members receive discounts on the article processing charges."
Current Issues in Molecular Biology,https://www.mdpi.com/journal/cimb,"Current Issues in Molecular Biology is an international, scientific, peer-reviewed, open access journal on molecular biology, published monthly online by MDPI (from Volume 43 Issue 1-2021)."
Current Oncology,https://www.mdpi.com/journal/curroncol,"Current Oncology is an international, peer-reviewed, open access journal published online by MDPI (from Volume 28 Issue 1-2021). Established in 1994, the journal represents a multidisciplinary medium for clinical oncologists to report and review progress in the management of this disease. The Canadian Association of Medical Oncologists (CAMO), the Canadian Association of Psychosocial Oncology (CAPO), the Canadian Association of General Practitioners in Oncology (CAGPO), the Cell Therapy Transplant Canada (CTTC), the Canadian Leukemia Study Group (CLSG) and others are affiliated with the journal and their members receive a discount on the article processing charges."
Dairy,https://www.mdpi.com/journal/dairy,"Dairy is an international, peer-reviewed, open access journal on dairy science published quarterly online by MDPI."
Data,https://www.mdpi.com/journal/data,"Data is a peer-reviewed, open access journal on data in science, with the aim of enhancing data transparency and reusability. The journal publishes in two sections: a section on the collection, treatment and analysis methods of data in science; a section publishing descriptions of scientific and scholarly datasets (one dataset per paper). The journal is published monthly online by MDPI."
Dentistry Journal,https://www.mdpi.com/journal/dentistry,"Dentistry Journal is an international, peer-reviewed, open access journal on dentistry published monthly online by MDPI."
Dermato,https://www.mdpi.com/journal/dermato,"Dermato is an international, peer-reviewed, open access journal on skin science published quarterly online by MDPI."
Dermatopathology,https://www.mdpi.com/journal/dermatopathology,"Dermatopathology is an international, peer-reviewed, open access journal on dermatopathology. The journal is owned by the European Society of Dermatopathology (ESDP) and is published quarterly online by MDPI (since Volume 7 Issue 1 - 2020)."
Designs,https://www.mdpi.com/journal/designs,"Designs is an international, peer-reviewed, open access journal of engineering designs published bimonthly online by MDPI."
Diabetology,https://www.mdpi.com/journal/diabetology,"Diabetology is an international, peer-reviewed, open access journal on diabetes research published quarterly online by MDPI."
Diagnostics,https://www.mdpi.com/journal/diagnostics,"Diagnostics is an international, peer-reviewed, open access journal on medical diagnosis published semimonthly online by MDPI. The British Neuro-Oncology Society (BNOS), the International Society for Infectious Diseases in Obstetrics and Gynaecology (ISIDOG) and the Swiss Union of Laboratory Medicine (SULM) are affiliated with Diagnostics and their members receive a discount on the article processing charges."
Dietetics,https://www.mdpi.com/journal/dietetics,"Dietetics is an international, peer-reviewed, open access journal on all aspects of human dietetics published quarterly online by MDPI."
Digital,https://www.mdpi.com/journal/digital,"Digital is an international, peer-reviewed, open access journal on digital technologies and digital application, particularly with how such technologies affect our health, education and economy, published quarterly online by MDPI."
Disabilities,https://www.mdpi.com/journal/disabilities,"Disabilities is an international, peer-reviewed, open access journal on the physical, biopsychosocial, and environmental aspects of disability, published quarterly online by MDPI."
Diseases,https://www.mdpi.com/journal/diseases,"Diseases is an international, peer-reviewed, open access, multidisciplinary journal which focuses on the latest and outstanding research on diseases and conditions published monthly online by MDPI. The first issue is released in 2013."
Diversity,https://www.mdpi.com/journal/diversity,"Diversity is a peer-reviewed, open access journal on the science of biodiversity from molecules, genes, populations, and species, to ecosystems and is published monthly online by MDPI."
DNA,https://www.mdpi.com/journal/dna,"DNA is an international, peer-reviewed, open access journal on DNA and DNA-related technologies published quarterly online by MDPI."
Drones,https://www.mdpi.com/journal/drones,"Drones is an international, peer-reviewed, open access journal published monthly online by MDPI. The journal focuses on design and applications of drones, including unmanned aerial vehicle (UAV), Unmanned Aircraft Systems (UAS), and Remotely Piloted Aircraft Systems (RPAS), etc. Likewise, contributions based on unmanned water/underwater drones and unmanned ground vehicles are also welcomed."
Drugs and Drug Candidates,https://www.mdpi.com/journal/ddc,"Drugs and Drug Candidates is an international, peer-reviewed, open access journal on drug discovery, development, and knowledge, published quarterly online by MDPI."
Dynamics,https://www.mdpi.com/journal/dynamics,"Dynamics is an international, peer-reviewed, open access journal on physical process. Dynamics is published quarterly online by MDPI."
Earth,https://www.mdpi.com/journal/earth,"Earth is an international, peer-reviewed, open access journal on earth science, published quarterly online by MDPI."
Ecologies,https://www.mdpi.com/journal/ecologies,"Ecologies is an international, peer-reviewed, open access journal on all aspects of ecology published quarterly online by MDPI."
Econometrics,https://www.mdpi.com/journal/econometrics,"Econometrics is an international, peer-reviewed, open access journal on econometric modeling and forecasting, as well as new advances in econometrics theory, and is published quarterly online by MDPI."
Economies,https://www.mdpi.com/journal/economies,"Economies is an international, peer-reviewed, open access journal on development economics and macroeconomics, published monthly online by MDPI."
Education Sciences,https://www.mdpi.com/journal/education,"Education Sciences is an international, peer-reviewed, open access journal on education published monthly online by MDPI. The European Network of Sport Education (ENSE) is affiliated with Education Sciences and its members receive discounts on the article processing charges."
Electricity,https://www.mdpi.com/journal/electricity,"Electricity is an international, peer-reviewed, open access journal on electrical engineering published quarterly online by MDPI."
Electrochem,https://www.mdpi.com/journal/electrochem,"Electrochem is an international, peer-reviewed, open access journal on electrochemistry published quarterly online by MDPI."
Electronic Materials,https://www.mdpi.com/journal/electronicmat,"Electronic Materials is an international, peer-reviewed, open access journal on fundamental science, engineering, and practical applications of electronic materials published quarterly online by MDPI."
Electronics,https://www.mdpi.com/journal/electronics,"Electronics is an international, peer-reviewed, open access journal on the science of electronics and its applications published semimonthly online by MDPI. The Polish Society of Applied Electromagnetics (PTZE) is affiliated with Electronics and their members receive a discount on article processing charges."
Emergency Care and Medicine,https://www.mdpi.com/journal/ecm,"Emergency Care and Medicine is an international, peer-reviewed, open access journal on emergency medicine published quarterly online by MDPI."
Encyclopedia,https://www.mdpi.com/journal/encyclopedia,"Encyclopedia is an international, peer-reviewed, open access journal recording qualified entries of which contents should be reliable, objective and established knowledge, and reviews that offer a comprehensive analysis of the extant literature, identifying current gaps or problems. The section Encyclopedia Studies also accepts original research articles. The Encyclopedia Journal is published quarterly online by MDPI, and it is affiliated with the Encyclopedia platform."
Endocrines,https://www.mdpi.com/journal/endocrines,"Endocrines is an international, peer-reviewed, open access journal on endocrinology published quarterly online by MDPI."
Energies,https://www.mdpi.com/journal/energies,"Energies is a peer-reviewed, open access journal of related scientific research, technology development, engineering policy, and management studies related to the general field of energy, from technologies of energy supply, conversion, dispatch, and final use to the physical and chemical processes behind such technologies. Energies is published semimonthly online by MDPI. The European Biomass Industry Association (EUBIA), Association of European Renewable Energy Research Centres (EUREC), Institute of Energy and Fuel Processing Technology (ITPE), International Society for Porous Media (InterPore), CYTED and others are affiliated with Energies and their members receive a discount on the article processing charges."
Eng,https://www.mdpi.com/journal/eng,"Eng is an international, peer-reviewed, open access journal on all areas of engineering, published quarterly online by MDPI."
Engineering Proceedings*,https://www.mdpi.com/journal/engproc,"Engineering Proceedings is an open access journal dedicated to publishing findings resulting from conferences, workshops, and similar events, in all areas of engineering. The conference organizers and proceedings editors are responsible for managing the peer-review process and selecting papers for conference proceedings."
Entropy,https://www.mdpi.com/journal/entropy,"Entropy is an international and interdisciplinary peer-reviewed open access journal of entropy and information studies, published monthly online by MDPI. The International Society for the Study of Information (IS4SI) and Spanish Society of Biomedical Engineering (SEIB) are affiliated with Entropy and their members receive a discount on the article processing charge."
Environmental Sciences Proceedings*,https://www.mdpi.com/journal/environsciproc,"Environmental Sciences Proceedings is an open access journal dedicated to publishing findings resulting from conferences, workshops, and similar events, in all areas of environmental sciences. The conference organizers and proceedings editors are responsible for managing the peer-review process and selecting papers for conference proceedings."
Environments,https://www.mdpi.com/journal/environments,"Environments is an international, peer-reviewed, open access journal on environmental sciences published monthly online by MDPI."
Epidemiologia,https://www.mdpi.com/journal/epidemiologia,"Epidemiologia is an international, peer-reviewed, open access journal on epidemiologic research published quarterly online by MDPI. The Italian Society of Environmental Medicine (SIMA) is affiliated with Epidemiologia, and its members receive discounts on article processing charges."
Epigenomes,https://www.mdpi.com/journal/epigenomes,"Epigenomes is an international, peer-reviewed, open access journal on epigenetics and epigenomics, published quarterly online by MDPI. The Epigenetics Society is affiliated with Epigenomes and its members receive discounts on the article processing charges."
European Burn Journal,https://www.mdpi.com/journal/ebj,"European Burn Journal (formerly European Journal of Burn Care) is an international, peer-reviewed, open access journal on burn care and burn prevention. The journal is owned by the European Burns Association (EBA) and is published quarterly online by MDPI."
"European Journal of Investigation in Health, Psychology and Education",https://www.mdpi.com/journal/ejihpe,"European Journal of Investigation in Health, Psychology and Education is a peer-reviewed, scientific journal that publishes original articles and systematic reviews or meta-analyses related to research on human development throughout the life cycle. The journal is owned by the University Association of Education and Psychology (previously published under the print ISSN 2174-8144) and is published monthly online by MDPI (since Volume 10, Issue 1 - 2020)."
Fermentation,https://www.mdpi.com/journal/fermentation,"Fermentation is an international, peer-reviewed, open access journal on fermentation process and technology published monthly online by MDPI."
Fibers,https://www.mdpi.com/journal/fibers,"Fibers is an international, peer-reviewed, open access journal on fiber science, published monthly online by MDPI."
FinTech,https://www.mdpi.com/journal/fintech,"FinTech is an international, peer-reviewed, open access journal on a variety of themes connected with financial technology, such as cryptocurrencies, risk management, robo-advising, crowdfunding, blockchain, new payment solutions, machine learning and AI for financial services, digital currencies, etc., published quarterly online by MDPI."
Fire,https://www.mdpi.com/journal/fire,"Fire is an international, peer-reviewed, open access journal about the science, policy, and technology of fires and how they interact with communities and the environment, published monthly online by MDPI. The Global Wildland Fire Network is affiliated with Fire."
Fishes,https://www.mdpi.com/journal/fishes,"Fishes is an international, peer-reviewed, scientific, open access journal published monthly online by MDPI. It covers fishes and aquatic animals research. The Iberian Society of Ichthyology (SIBIC) and the Brazilian Society of Aquaculture and Aquatic Biology (Aquabio) are affiliated with Fishes and their members receive a discount on the article processing charges."
Fluids,https://www.mdpi.com/journal/fluids,"Fluids is an international, peer-reviewed, open access journal on all aspects of fluids, published monthly online by MDPI. The Portuguese Society of Rheology (SPR) is affiliated with Fluids and its members receive discounts on the article processing charges."
Foods,https://www.mdpi.com/journal/foods,"Foods is an international, peer-reviewed, open access journal on food science published semimonthly online by MDPI. The Italian Society of Food Sciences (SISA) and Spanish Nutrition Foundation (FEN) are affiliated with Foods and their members receive discounts on the article processing charges."
Forecasting,https://www.mdpi.com/journal/forecasting,"Forecasting is an international, peer-reviewed, open access journal on all aspects of forecasting published quarterly online by MDPI."
Forensic Sciences,https://www.mdpi.com/journal/forensicsci,"Forensic Sciences is an international, peer-reviewed, open access journal on all aspects of forensic science published quarterly online by MDPI. The Portuguese Association of Forensic Sciences (APCF) is affiliated with Forensic Sciences and their members receive a discount on the article processing charges."
Forests,https://www.mdpi.com/journal/forests,"Forests is an international, peer-reviewed, open access journal on forestry and forest ecology published monthly online by MDPI."
Fossil Studies,https://www.mdpi.com/journal/fossstud,"Fossil Studies - formerly Fossils - is an international, peer-reviewed, open access journal on all aspects of palaeontology published quarterly online by MDPI."
Foundations,https://www.mdpi.com/journal/foundations,"Foundations is an international, peer-reviewed, open access journal on mathematics, physics and chemistry published quarterly online by MDPI."
Fractal and Fractional,https://www.mdpi.com/journal/fractalfract,"Fractal and Fractional is an international, scientific, peer-reviewed, open access journal of fractals and fractional calculus and their applications in different fields of science and engineering published monthly online by MDPI."
Fuels,https://www.mdpi.com/journal/fuels,"Fuels is an international, peer-reviewed, open access journal on fuel science, published quarterly online by MDPI. The Institute of Energy and Fuel Processing Technology (ITPE) is affiliated to Fuels and their members receive a discount on the article processing charges."
Future,https://www.mdpi.com/journal/future,"Future is an international, peer-reviewed, open access journal focused on the research areas of growth and development and school health published quarterly online by MDPI."
Future Internet,https://www.mdpi.com/journal/futureinternet,"Future Internet is an international, peer-reviewed, open access journal on internet technologies and the information society, published monthly online by MDPI."
Future Pharmacology,https://www.mdpi.com/journal/futurepharmacol,"Future Pharmacology is an international, peer-reviewed, open access journal on pharmacology, drug discovery, and therapeutics published quarterly online by MDPI."
Future Transportation,https://www.mdpi.com/journal/futuretransp,"Future Transportation is an international, peer-reviewed, open access journal on the civil engineering, economics, environment and geography, computer science and other transdisciplinary dimensions of transportation published quarterly online by MDPI."
Galaxies,https://www.mdpi.com/journal/galaxies,"Galaxies is an international, peer-reviewed, open access journal on astronomy, astrophysics, and cosmology published bimonthly online by MDPI."
Games,https://www.mdpi.com/journal/games,"Games is a scholarly, peer-reviewed, open access journal of studies on game theory and its applications published bimonthly online by MDPI."
Gases,https://www.mdpi.com/journal/gases,"Gases is an international, peer-reviewed, open access journal on the field of applied science and engineering advances in natural gas, greenhouse gas control, and gas sensors, published quarterly online by MDPI."
Gastroenterology Insights,https://www.mdpi.com/journal/gastroent,"Gastroenterology Insights is an international, scientific, peer-reviewed open access journal on gastrointestinal diseases published quarterly online by MDPI (from Volume 11 Issue 1 - 2020)."
Gastrointestinal Disorders,https://www.mdpi.com/journal/gastrointestdisord,"Gastrointestinal Disorders is an international, open access, peer-reviewed journal on gastroenterology, published quarterly online by MDPI."
Gastronomy,https://www.mdpi.com/journal/gastronomy,"Gastronomy is an international, peer-reviewed, open access journal on gastronomy and culinary arts published quarterly online by MDPI."
Gels,https://www.mdpi.com/journal/gels,"Gels is an international, peer-reviewed, open access journal on physical and chemical gels published monthly online by MDPI."
Genealogy,https://www.mdpi.com/journal/genealogy,"Genealogy is an international, scholarly, peer-reviewed, open access journal devoted to the analysis of genealogical narratives (with applications for family, race/ethnic, gender, migration and science studies) and scholarship that uses genealogical theory and methodologies to examine historical processes. The journal is published quarterly online by MDPI."
Genes,https://www.mdpi.com/journal/genes,"Genes is a peer-reviewed, open access journal of genetics and genomics published monthly online by MDPI. The Spanish Society for Biochemistry and Molecular Biology (SEBBM) is affiliated with Genes and their members receive discounts on the article processing charges."
Geographies,https://www.mdpi.com/journal/geographies,"Geographies is an international, peer-reviewed, open access journal on geography published quarterly online by MDPI."
GeoHazards,https://www.mdpi.com/journal/geohazards,"GeoHazards is an international, peer-reviewed, open access journal on theoretical and applied research across the whole spectrum of geomorphological hazards, namely endogenous and exogenous hazards, as well as those related to climate change and human activity, published quarterly online by MDPI."
Geomatics,https://www.mdpi.com/journal/geomatics,"Geomatics is an international, peer-reviewed, open access journal on geomatic science published quarterly online by MDPI."
Geosciences,https://www.mdpi.com/journal/geosciences,"Geosciences is an international, peer-reviewed open access journal on geoscience, future earth and planetary science published monthly online by MDPI. The European Federation of Geologists (EFG) is affiliated with Geosciences, and its members receive a discount on the article processing charge."
Geotechnics,https://www.mdpi.com/journal/geotechnics,"Geotechnics is an international, peer-reviewed, open access journal on geotechnical engineering published quarterly online by MDPI."
Geriatrics,https://www.mdpi.com/journal/geriatrics,"Geriatrics is an international, peer-reviewed, scientific open access journal on geriatric medicine published bimonthly online by MDPI."
Glacies,https://www.mdpi.com/journal/glacies,"Glacies is an international, peer-reviewed, open access journal on all aspects of the studies related to ice published quarterly online by MDPI."
"Gout, Urate, and Crystal Deposition Disease",https://www.mdpi.com/journal/gucdd,"Gout, Urate, and Crystal Deposition Disease is an international, peer-reviewed, open access journal on gout, urate, and crystal deposition disease, published quarterly online by MDPI. The journal is owned by the Gout, Hyperuricemia and Crystal Associated Disease Network (G-CAN) and its members receive discounts on the article processing charges."
Grasses,https://www.mdpi.com/journal/grasses,"Grasses is an international, peer-reviewed, open access journal on all fundamental and applied fields of grass, published quarterly online by MDPI."
Hardware,https://www.mdpi.com/journal/hardware,"Hardware is an international, peer-reviewed, open access journal on open source hardware designs published quarterly online by MDPI."
Healthcare,https://www.mdpi.com/journal/healthcare,"Healthcare is an international, scientific, peer-reviewed, open access journal on health care systems, industry, technology, policy, and regulation, and is published semimonthly online by MDPI. Ocular Wellness & Nutrition Society (OWNS) is affiliated with Healthcare and its members receive discounts on article processing charges."
Hearts,https://www.mdpi.com/journal/hearts,"Hearts is an international, peer-reviewed, open access journal on cardiology and cardiac & vascular surgery, published quarterly online by MDPI."
Hemato,https://www.mdpi.com/journal/hemato,"Hemato - formerly Bloods - is an international, peer-reviewed, open access journal on hematology, published quarterly online by MDPI. The Spanish Society of Hematology and Hemotherapy (SEHH) and the Nuclear Medicine Discovery (Nu.Me.D.) are affiliated with Hemato and their members receive a discount on the article processing charges."
