title,link,description
Acoustics,https://www.mdpi.com/journal/acoustics,"Acoustics is an international, peer-reviewed, open access journal on acoustics science and engineering, published quarterly online by MDPI."
Acta Microbiologica Hellenica,https://www.mdpi.com/journal/amh,"Acta Microbiologica Hellenica is an international, peer-reviewed, open access journal on medical microbiology. The journal is owned by the Hellenic Society for Microbiology and is published quarterly online by MDPI (since Volume 69, Issue 1 - 2024). The Hellenic Society for Microbiology is affiliated with AMH and its members receive discounts on the article processing charges."
Actuators,https://www.mdpi.com/journal/actuators,"Actuators is an international, peer-reviewed, open access journal on the science and technology of actuators and control systems published monthly online by MDPI."
Administrative Sciences,https://www.mdpi.com/journal/admsci,"Administrative Sciences is an international, peer-reviewed, scholarly, open access journal on organization studies published monthly online by MDPI."
Adolescents,https://www.mdpi.com/journal/adolescents,"Adolescents is an international, peer-reviewed, open access journal on adolescent development and health sciences published quarterly online by MDPI."
Advances in Respiratory Medicine,https://www.mdpi.com/journal/arm,"Advances in Respiratory Medicine is an international, peer-reviewed, open access journal on respiratory medicine, covering allergology, oncology, immunology, and infectious diseases of the respiratory system. The journal is owned by the Polish Respiratory Society and is published bimonthly online by MDPI (since Volume 90, Issue 4 - 2022)."
Aerobiology,https://www.mdpi.com/journal/aerobiology,"Aerobiology is an international, peer-reviewed, open access journal on environmental sciences and public environmental occupational health published quarterly online by MDPI."
Aerospace,https://www.mdpi.com/journal/aerospace,"Aerospace is a peer-reviewed, open access journal of aeronautics and astronautics published monthly online by MDPI. The European Aeronautics Science Network (EASN), and the ECATS International Association are affiliated with Aerospace and their members receive a discount on the article processing charges."
Agriculture,https://www.mdpi.com/journal/agriculture,"Agriculture is an international, scientific peer-reviewed open access journal published monthly online by MDPI."
AgriEngineering,https://www.mdpi.com/journal/agriengineering,"AgriEngineering is an international, peer-reviewed, open access journal on the engineering science of agricultural and horticultural production, published quarterly online by MDPI."
Agrochemicals,https://www.mdpi.com/journal/agrochemicals,"Agrochemicals is an international, peer-reviewed, open access journal on all aspects of agrochemicals published quarterly online by MDPI."
Agronomy,https://www.mdpi.com/journal/agronomy,"Agronomy is an international, peer-reviewed, open access journal on agronomy and agroecology published monthly online by MDPI. The Spanish Society of Plant Physiology (SEFV) is affiliated with Agronomy and their members receive discounts on the article processing charges."
AI,https://www.mdpi.com/journal/ai,"AI is an international, peer-reviewed, open access journal on artificial intelligence (AI), including broad aspects of cognition and reasoning, perception and planning, machine learning, intelligent robotics, and applications of AI, published quarterly online by MDPI."
Air,https://www.mdpi.com/journal/air,"Air is an international, peer-reviewed, open access journal on all aspects of air research, including air science, air technology, air management and governance, published quarterly online by MDPI."
Algorithms,https://www.mdpi.com/journal/algorithms,"Algorithms is a peer-reviewed, open access journal which provides an advanced forum for studies related to algorithms and their applications. Algorithms is published monthly online by MDPI. The European Society for Fuzzy Logic and Technology (EUSFLAT) is affiliated with Algorithms and their members receive discounts on the article processing charges."
Allergies,https://www.mdpi.com/journal/allergies,"Allergies is an international, peer-reviewed, open access journal on allergy and immunology published quarterly online by MDPI."
Alloys,https://www.mdpi.com/journal/alloys,"Alloys is an international, peer-reviewed, open access journal on all aspects of alloys science and engineering, published quarterly online by MDPI."
Analytica,https://www.mdpi.com/journal/analytica,"Analytica is an international, peer-reviewed, open access journal on analytical chemistry and chemical analysis published quarterly online by MDPI."
Analytics,https://www.mdpi.com/journal/analytics,"Analytics is an international, peer-reviewed, open access journal on methodologies, technologies, and applications of analytics, published quarterly online by MDPI."
Anatomia,https://www.mdpi.com/journal/anatomia,"Anatomia is an international, peer-reviewed, open access journal on anatomy published quarterly online by MDPI."
Anesthesia Research,https://www.mdpi.com/journal/anesthres,"Anesthesia Research is an international, peer-reviewed, open access journal on anesthesia research and practices published quarterly online by MDPI."
Animals,https://www.mdpi.com/journal/animals,"Animals is an international, peer-reviewed, open access journal devoted entirely to animals, including zoology and veterinary sciences, published semimonthly online by MDPI. The World Association of Zoos and Aquariums (WAZA), European College of Animal Welfare and Behavioural Medicine (ECAWBM), and Federation of European Laboratory Animal Science Associations (FELASA) are affiliated with Animals and their members receive a discount on the article processing charges."
Antibiotics,https://www.mdpi.com/journal/antibiotics,"Antibiotics is an international, peer-reviewed, open access journal on all aspects of antibiotics, published monthly online by MDPI."
Antibodies,https://www.mdpi.com/journal/antibodies,"Antibodies is an international, peer-reviewed, open access journal on immunoglobulins, published quarterly online by MDPI."
Antioxidants,https://www.mdpi.com/journal/antioxidants,"Antioxidants is an international, peer-reviewed, open access journal, published monthly online by MDPI. The International Coenzyme Q10 Association (ICQ10A), Israel Society for Oxygen and Free Radical Research (ISOFRR) and European Academy for Molecular Hydrogen Research (EAMHR) are affiliated with Antioxidants and their members receive discounts on the article processing charge."
Applied Biosciences,https://www.mdpi.com/journal/applbiosci,"Applied Biosciences is an international, peer-reviewed, open access journal on all aspects of applied biosciences published quarterly online by MDPI."
Applied Mechanics,https://www.mdpi.com/journal/applmech,"Applied Mechanics is an international, peer-reviewed, open access journal on applied mechanics, published quarterly online by MDPI."
Applied Microbiology,https://www.mdpi.com/journal/applmicrobiol,"Applied Microbiology is an international, peer-reviewed, open access journal on application of microorganisms published quarterly online by MDPI."
Applied Nano,https://www.mdpi.com/journal/applnano,"Applied Nano is an international, peer-reviewed, open access journal on all aspects of application of nanoscience and nanotechnology, published quarterly online by MDPI."
Applied Sciences,https://www.mdpi.com/journal/applsci,"Applied Sciences is an international, peer-reviewed, open access journal on all aspects of applied natural sciences published semimonthly online by MDPI."
Applied System Innovation,https://www.mdpi.com/journal/asi,"Applied System Innovation is an international, peer-reviewed, open access journal on integrated engineering and technology. The journal is owned by the International Institute of Knowledge Innovation and Invention (IIKII) and is published bimonthly online by MDPI."
AppliedChem,https://www.mdpi.com/journal/appliedchem,"AppliedChem is an international, peer-reviewed, open access journal on all aspects of applied chemistry published quarterly online by MDPI."
AppliedMath,https://www.mdpi.com/journal/appliedmath,"AppliedMath is an international, peer-reviewed, open access journal on applied mathematics published quarterly online by MDPI."
Aquaculture Journal,https://www.mdpi.com/journal/aquacj,"Aquaculture Journal is an international, peer-reviewed, open access journal on aquaculture-related aquatic science published quarterly online by MDPI."
Architecture,https://www.mdpi.com/journal/architecture,"Architecture is an international, peer-reviewed, open access journal on studies related to architectural research published quarterly online by MDPI."
Arthropoda,https://www.mdpi.com/journal/arthropoda,"Arthropoda - formerly Entomology - is an international, peer-reviewed, open access journal on the study of arthropods published quarterly online by MDPI."
Arts,https://www.mdpi.com/journal/arts,"Arts is an international, peer-reviewed, open access journal promoting significant research on all aspects of the visual and performing arts, published bimonthly online by MDPI."
Astronomy,https://www.mdpi.com/journal/astronomy,"Astronomy is an international, peer-reviewed, open access journal on observational astronomy, theoretical astronomy and other specific subfields published quarterly online by MDPI."
Atmosphere,https://www.mdpi.com/journal/atmosphere,"Atmosphere is an international, peer-reviewed, open access journal of scientific studies related to the atmosphere published monthly online by MDPI. The Italian Aerosol Society (IAS) and Working Group of Air Quality in European Citizen Science Association (ECSA) are affiliated with Atmosphere and their members receive a discount on the article processing charges."
Atoms,https://www.mdpi.com/journal/atoms,"Atoms is an international, peer-reviewed, open access journal on all aspects of the atom published monthly online by MDPI."
Audiology Research,https://www.mdpi.com/journal/audiolres,"Audiology Research is an international, scientific, peer-reviewed, open access journal on audiology and neurotology, published bimonthly online by MDPI (from Volume 10, Issue 2 - 2020). The Italian Society of Vestibology (VIS) is affiliated with Audiology Research and its members receive a discount on the article processing charges."
Automation,https://www.mdpi.com/journal/automation,"Automation is an international, peer-reviewed, open access journal on automation and control systems published quarterly online by MDPI."
Axioms,https://www.mdpi.com/journal/axioms,"Axioms is an international, peer-reviewed, open access journal of mathematics, mathematical logic and mathematical physics, published monthly online by MDPI. The European Society for Fuzzy Logic and Technology (EUSFLAT), International Fuzzy Systems Association (IFSA) and Union of Slovak Mathematicians and Physicists (JSMF) are affiliated with Axioms and their members receive discounts on the article processing charges."
Bacteria,https://www.mdpi.com/journal/bacteria,"Bacteria is an international, peer-reviewed, open access journal on bacteriology published quarterly online by MDPI."
Batteries,https://www.mdpi.com/journal/batteries,"Batteries is an international, peer-reviewed, open access journal on battery technology and materials published monthly online by MDPI. International Society for Porous Media (InterPore) is affiliated with Batteries and their members receive discounts on the article processing charges."
Behavioral Sciences,https://www.mdpi.com/journal/behavsci,"Behavioral Sciences is an international, peer-reviewed, open access journal on psychology, neuroscience, cognitive science, behavioral biology and behavioral genetics published monthly online by MDPI."
Beverages,https://www.mdpi.com/journal/beverages,"Beverages is an international, peer-reviewed, open access journal on beverage research and development published quarterly online by MDPI."
Big Data and Cognitive Computing,https://www.mdpi.com/journal/BDCC,"Big Data and Cognitive Computing is an international, peer-reviewed, open access journal on big data and cognitive computing published monthly online by MDPI."
BioChem,https://www.mdpi.com/journal/biochem,"BioChem is an international, peer-reviewed, open access journal on biochemistry published quarterly online by MDPI."
Bioengineering,https://www.mdpi.com/journal/bioengineering,"Bioengineering is an international, scientific, peer-reviewed, open access journal on the science and technology of bioengineering, published monthly online by MDPI. The Society for Regenerative Medicine (Russian Federation) (RPO) is affiliated with Bioengineering and its members receive discounts on the article processing charges."
Biologics,https://www.mdpi.com/journal/biologics,"Biologics is an international, peer-reviewed, open access journal on all areas of biologics derived from both novel and established biotechnologies, published quarterly online by MDPI."
Biology,https://www.mdpi.com/journal/biology,"Biology is an international, peer-reviewed, open access journal of biological sciences published monthly online by MDPI. The Spanish Society for Nitrogen Fixation (SEFIN) and Federation of European Laboratory Animal Science Associations (FELASA) are affiliated with Biology, and their members receive discounts on the article processing charges."
Biology and Life Sciences Forum*,https://www.mdpi.com/journal/blsf,"Biology and Life Sciences Forum is an open access journal dedicated to publishing findings resulting from conferences, workshops, and similar events, in all areas of biology, life sciences and at the interface of related disciplines. The conference organizers and proceedings editors are responsible for managing the peer-review process and selecting papers for conference proceedings."
Biomass,https://www.mdpi.com/journal/biomass,"Biomass is an international, peer-reviewed, open access journal on biomass conversion and biorefinery published quarterly online by MDPI."
Biomechanics,https://www.mdpi.com/journal/biomechanics,"Biomechanics is an international, peer-reviewed, open access journal on biomechanics research published quarterly online by MDPI."
BioMed,https://www.mdpi.com/journal/biomed,"BioMed is an international, peer-reviewed, open access journal on the broad field of subjects in human life science and medicine published quarterly online by MDPI."
Biomedicines,https://www.mdpi.com/journal/biomedicines,"Biomedicines is an international, peer-reviewed, open access journal on biomedicines published monthly online by MDPI. The Society for Regenerative Medicine (Russian Federation) (RPO) is affiliated with Biomedicines and its members receive discounts on the article processing charges."
BioMedInformatics,https://www.mdpi.com/journal/biomedinformatics,"BioMedInformatics is an international, peer-reviewed, open access journal on all areas of biomedical informatics, as well as computational biology and medicine, published quarterly online by MDPI."
Biomimetics,https://www.mdpi.com/journal/biomimetics,"Biomimetics is an international, peer-reviewed, open access journal on biomimicry and bionics, published monthly online by MDPI. The International Society of Bionic Engineering (ISBE) is affiliated with Biomimetics."
Biomolecules,https://www.mdpi.com/journal/biomolecules,"Biomolecules is a peer-reviewed, open access journal on structures and functions of bioactive and biogenic substances, molecular mechanisms with biological and medical implications as well as biomaterials and their applications. Biomolecules is published monthly online by MDPI. The Spanish Society for Biochemistry and Molecular Biology (SEBBM) is affiliated with Biomolecules and their members receive discounts on the article processing charges."
Biophysica,https://www.mdpi.com/journal/biophysica,"Biophysica is an international, peer-reviewed, open access journal on applying the methods of physics, chemistry, and math to study biological systems, published quarterly online by MDPI."
Biosensors,https://www.mdpi.com/journal/biosensors,"Biosensors is an international, peer-reviewed, open access journal on the technology and science of biosensors published monthly online by MDPI."
BioTech,https://www.mdpi.com/journal/biotech,"BioTech - formerly High-Throughput - is an international, peer-reviewed, open access journal on biotechnology, published quarterly online by MDPI."
Birds,https://www.mdpi.com/journal/birds,"Birds is an international, peer-reviewed, open access journal on ornithology published quarterly online by MDPI."
Blockchains,https://www.mdpi.com/journal/blockchains,"Blockchains is an international, peer-reviewed, open access journal on blockchain and its applications published quarterly online by MDPI."
Brain Sciences,https://www.mdpi.com/journal/brainsci,"Brain Sciences is an international, peer-reviewed, open access journal on neuroscience published monthly online by MDPI."
Buildings,https://www.mdpi.com/journal/buildings,"Buildings is an international, peer-reviewed, open access journal on building science, building engineering and architecture published monthly online by MDPI. The International Council for Research and Innovation in Building and Construction (CIB) is affiliated with Buildings and their members receive a discount on the article processing charges."
Businesses,https://www.mdpi.com/journal/businesses,"Businesses is an international, peer-reviewed, open access journal on business published quarterly online by MDPI."
C,https://www.mdpi.com/journal/carbon,"C — Journal of Carbon Research is an international, scientific, peer-reviewed, open access journal on carbon research, published quarterly online by MDPI. The Spanish Carbon Group (GEC) is affiliated with C — Journal of Carbon Research and its members receive discounts on article processing charges."
Cancers,https://www.mdpi.com/journal/cancers,"Cancers is a peer-reviewed, open access journal of oncology, published semimonthly online by MDPI. The Irish Association for Cancer Research (IACR), Spanish Association for Cancer Research (ASEICA), Biomedical Research Centre (CIBM), British Neuro-Oncology Society (BNOS) and Spanish Group for Cancer Immuno-Biotherapy (GÉTICA) are affiliated with Cancers and their members receive a discount on the article processing charges."
Cardiogenetics,https://www.mdpi.com/journal/cardiogenetics,"Cardiogenetics is an international, scientific, peer-reviewed, open access journal, published quarterly online by MDPI (from Volume 10 Issue 2 - 2020)."
Catalysts,https://www.mdpi.com/journal/catalysts,Catalysts is a peer-reviewed open access journal of catalysts and catalyzed reactions published monthly online by MDPI. The Romanian Catalysis Society (RCS) are partners of Catalysts journal and its members receive a discount on the article processing charge.
Cells,https://www.mdpi.com/journal/cells,"Cells is an international, peer-reviewed, open access journal on cell biology, molecular biology, and biophysics, published semimonthly online by MDPI. The Spanish Society for Biochemistry and Molecular Biology (SEBBM), Nordic Autophagy Society (NAS), Spanish Society of Hematology and Hemotherapy (SEHH) and Society for Regenerative Medicine (Russian Federation) (RPO) are affiliated with Cells and their members receive discounts on the article processing charges."
Ceramics,https://www.mdpi.com/journal/ceramics,"Ceramics is an international, peer-reviewed, open access journal of ceramics science and engineering, published quarterly online by MDPI."
Challenges,https://www.mdpi.com/journal/challenges,"Challenges is an interdisciplinary, peer-reviewed, open access journal that welcomes contributions to any problem, or any aspect of the Grand Challenges facing our world and our societies today. It is published quarterly online by MDPI and addresses the pressing need to accelerate integrated cross-sectoral discourse and collaborative solutions to improve every aspect of life on our planet. Challenges is part of the growing planetary health movement. The Nova Network (formerly inVIVO Planetary Health) is affiliated with Challenges, and is a member of the Planetary Health Alliance."
ChemEngineering,https://www.mdpi.com/journal/ChemEngineering,"ChemEngineering is an international, peer-reviewed, open access journal on the science and technology of chemical engineering, published bimonthly online by MDPI."
Chemistry,https://www.mdpi.com/journal/chemistry,"Chemistry is an international, peer-reviewed, open access journal on chemistry published bimonthly online by MDPI."
Chemistry Proceedings*,https://www.mdpi.com/journal/chemproc,"Chemistry Proceedings is an open access journal dedicated to publishing findings resulting from conferences, workshops, and similar events, in all areas of chemistry. The conference organizers and proceedings editors are responsible for managing the peer review process and selecting papers for conference proceedings."
Chemosensors,https://www.mdpi.com/journal/chemosensors,"Chemosensors is an international, scientific, peer-reviewed, open access journal on the science and technology of chemical sensors and related analytical methods and systems, published monthly online by MDPI."
Children,https://www.mdpi.com/journal/children,"Children is an international, peer-reviewed, open access journal on children’s health published monthly online by MDPI."
Chips,https://www.mdpi.com/journal/chips,"Chips is an international, peer-reviewed, open access journal on all aspects of chips published quarterly online by MDPI."
CivilEng,https://www.mdpi.com/journal/civileng,"CivilEng is an international, peer-reviewed, open access journal of civil engineering, published quarterly online by MDPI."
Clean Technologies,https://www.mdpi.com/journal/cleantechnol,"Clean Technologies is an international, peer-reviewed, open access journal of scientific research on technology development aiming to reduce the environmental impact of human activities, and is published quarterly online by MDPI."
Climate,https://www.mdpi.com/journal/climate,"Climate is a scientific, peer-reviewed, open access journal of climate science published online monthly by MDPI. The American Society of Adaptation Professionals (ASAP) is affiliated with Climate and its members receive discounts on the article processing charges."
Clinical and Translational Neuroscience,https://www.mdpi.com/journal/ctn,"Clinical and Translational Neuroscience is an international, peer-reviewed, open access journal on neuroscience. The journal is owned by the Swiss Federation of Clinical Neuro-Societies and is published quarterly online by MDPI (from Volume 5 Issue 2-2021)."
Clinics and Practice,https://www.mdpi.com/journal/clinpract,"Clinics and Practice is an international, scientific, peer-reviewed, open access journal on clinical medicine, published bimonthly online by MDPI (from Volume 11, Issue 1 - 2021)."
Clocks & Sleep,https://www.mdpi.com/journal/clockssleep,"Clocks & Sleep is a peer-reviewed, open access journal that investigates a wide range of sleep related topics and is published quarterly online by MDPI. The Australasian Chronobiology Society, Society for Light Treatment and Biological Rhythms, and Swiss Society of Sleep Research, Sleep Medicine and Chronobiology are affiliated with Clocks & Sleep and the society members receive a discount on the article processing charges."
Coasts,https://www.mdpi.com/journal/coasts,"Coasts is an international, peer-reviewed, open access journal on coastal engineering, management, conservation, biology and ecology, published quarterly online by MDPI."
Coatings,https://www.mdpi.com/journal/coatings,"Coatings is an international, peer-reviewed, open access journal on coatings and surface engineering published monthly online by MDPI. The Korean Tribology Society (KTS) is affiliated with Coatings and its members receive discounts on the article processing charges."
Colloids and Interfaces,https://www.mdpi.com/journal/colloids,"Colloids and Interfaces is an international, peer-reviewed, open access journal on colloids and interfaces chemistry published bimonthly online by MDPI."
Colorants,https://www.mdpi.com/journal/colorants,"Colorants is an international, peer-reviewed, open access journal on all aspects of coloring matters published quarterly online by MDPI."
Commodities,https://www.mdpi.com/journal/commodities,"Commodities is an international, peer-reviewed, open access journal on economics, finance, and commerce published quarterly online by MDPI."
Complications,https://www.mdpi.com/journal/complications,"Complications (ISSN 2813-4966) is an international, peer-reviewed, open access journal on the prevention, diagnosis, etiology, and management of complications in all aspects of basic, translational, and clinical research, as well as epidemiology. The journal seeks to offer best practices and expert experience, and recommendations on intra-operative and post-operative adverse events, published quarterly online by MDPI."
Compounds,https://www.mdpi.com/journal/compounds,"Compounds is an international, peer-reviewed, open access journal on chemical compounds published quarterly online by MDPI."
Computation,https://www.mdpi.com/journal/computation,Computation is a peer-reviewed journal of computational science and engineering published monthly online by MDPI.
